id,title,description,pdf_url,created_at
1,Member Handbook 2024,"Complete guide for IEI members including rules, benefits, and procedures",/uploads/downloads/member_handbook_2024.pdf,2026-05-05 13:49:35.938400
2,Technical Standards & Guidelines,Latest engineering standards and best practices for construction,/uploads/downloads/technical_standards.pdf,2026-05-05 13:49:35.938404
3,Code of Ethics for Engineers,Professional ethics and conduct guidelines for practicing engineers,/uploads/downloads/ethics_code.pdf,2026-05-05 13:49:35.938406
4,Continuing Professional Development (CPD) Requirements,Guidelines on CPD points and requirements for members,/uploads/downloads/cpd_requirements.pdf,2026-05-05 13:49:35.938408
5,Past Conference Proceedings 2023,Technical papers and presentations from 2023 conference,/uploads/downloads/conference_2023.pdf,2026-05-05 13:49:35.938409
