id,title,description,image_url,created_at
1,Annual Conference 2024,Highlights from the IEI Kanyakumari Annual Conference,/uploads/gallery/conference_2024.jpg,2026-05-05 13:49:35.815813
2,Technical Workshop - IoT & Automation,Participants learning about IoT applications in industries,/uploads/gallery/iot_workshop_2024.jpg,2026-05-05 13:49:35.815817
3,Member Networking Session,Engineers interacting and networking at the center,/uploads/gallery/networking_2024.jpg,2026-05-05 13:49:35.815819
4,Infrastructure Site Visit,Members visiting a major infrastructure project,/uploads/gallery/site_visit_2024.jpg,2026-05-05 13:49:35.815820
5,Student Mentorship Program,Senior engineers mentoring engineering students,/uploads/gallery/mentorship_2024.jpg,2026-05-05 13:49:35.815822
